{
  "kind": "app-update",
  "updateFeedUrl": "https://updates.useful.example/appcast.json",
  "updateTrustRoot": {
    "updateRootKeyFingerprint": "5e884898da28047151d0e56f8dc6292773603d0d6aabbdd62a11ef721d1542d8",
    "confirmedAt": "2026-07-20T09:00:00Z"
  },
  "isDefaultOfficial": true,
  "warningAcknowledgedAt": null
}
